<?xml version="1.0" encoding="utf-8"?> 
<widget xmlns="http://www.w3.org/ns/widgets" id="http://www.getwookie.org/widgets/WP3/natter" version="1.0" height="383" width="255" xmlns:xsi="http://www.w3.org/2001/XMLSchema-instance" xsi:schemaLocation="http://www.w3.org/ns/widgets w3cwidgets_v1p2.xsd">
	<name>Natter</name>
	<description>basic chat widget</description>
	<icon src="Icon.png"/>
	<content src="chat.htm"/>
	<access uri="true"/>
	<author>Scott Wilson</author>
	<license>None</license>
    <preference name="pref1" value="1" readonly="true"/>
    <preference name="pref2" value="2" readonly="false"/>
    <preference name="pref3" />
</widget>