<?xml version="1.0" encoding="UTF-8"?>
<widget xml:lang="EN" height="0" id="http://tempuri.org"  version="" viewmodes="application" width="0" xmlns="http://www.w3.org/ns/widgets" xmlns:xsi="http://www.w3.org/2001/XMLSchema-instance" xsi:schemaLocation="http://www.w3.org/ns/widgets w3cwidgets_v1p2.xsd ">
  <name xml:lang="EN" short="">name</name>
  <name xml:lang="nl" short="">name</name>
  <description xml:lang="EN">description</description>
  <description xml:lang="nl" >description</description>
  <author email="" href="http://tempuri.org">author</author>
  <license xml:lang="EN" href="asa">licence</license>
  <license xml:lang="nl" href="asa">licence</license>
  <icon height="0" src="" width="0"/>
  <icon src=""/>
  <content charset="" src="" type=""/>
  <feature name="http://tempuri.org" required="true">
  	<param name="" value=""></param>
  	<param name="" value=""/>
  	<param name="" value=""/>
  	<param name="" value=""/>
  </feature>
 <feature name="http://tempuri.org">
  	<param name="" value=""></param>
  	<param name="" value=""/>
  	<param name="" value=""/>
  	<param name="" value=""/>
  </feature>  
  <preference name="" readonly="true" value=""/>
  <preference name=""/>
</widget>
